{
  "schema_version": "1.0",
  "id": "gpt-5.4-mini-perceptual",
  "benchmark_id": "stop-sign-perceptual",
  "benchmark_hash": "sha256:1ed07a656b262cabbd84e7ce28587ebfc1805b3914beb2c1cf0e57013395cb32",
  "model": {
    "provider": "openai",
    "model_id": "gpt-5.4-mini",
    "params": {
      "temperature": 0.0,
      "max_tokens": 2048,
      "stop": []
    }
  },
  "endorsement_config": {
    "n_samples": 3,
    "tie_break": "abstain",
    "verification_prompt_id": "defeasible-explicit-v1",
    "context_builder_premise_id": "conjunction-and-v1",
    "context_builder_conclusion_id": "disjunction-or-v1"
  },
  "framework_version": "0.1.0",
  "started_at": "2026-05-18T21:00:58.536215Z",
  "finished_at": "2026-05-18T21:01:06.222001Z",
  "items": [
    {
      "id": "row-0",
      "premises": [
        "sa"
      ],
      "conclusions": [
        "ra"
      ],
      "analyst_verdicts": [
        "good"
      ],
      "model_verdict": "good",
      "samples": [
        {
          "sample_index": 0,
          "raw_response": "GOOD",
          "parsed_verdict": "good",
          "parse_status": "ok",
          "request_id": "gpt-5.4-mini-perceptual:row-0:sample-0",
          "wall_time_ms": 522.5542919943109,
          "usage": {
            "input_tokens": 228,
            "output_tokens": 4
          }
        },
        {
          "sample_index": 1,
          "raw_response": "GOOD",
          "parsed_verdict": "good",
          "parse_status": "ok",
          "request_id": "gpt-5.4-mini-perceptual:row-0:sample-1",
          "wall_time_ms": 714.0218329732306,
          "usage": {
            "input_tokens": 228,
            "output_tokens": 4
          }
        },
        {
          "sample_index": 2,
          "raw_response": "GOOD",
          "parsed_verdict": "good",
          "parse_status": "ok",
          "request_id": "gpt-5.4-mini-perceptual:row-0:sample-2",
          "wall_time_ms": 533.7745420401916,
          "usage": {
            "input_tokens": 228,
            "output_tokens": 4
          }
        }
      ],
      "majority_vote": {
        "good": 3,
        "bad": 0,
        "abstain": 0,
        "verdict": "good",
        "tie_broken": false
      },
      "tags": [
        "base-inference"
      ]
    },
    {
      "id": "row-1",
      "premises": [
        "n",
        "sa"
      ],
      "conclusions": [
        "ra"
      ],
      "analyst_verdicts": [
        "good"
      ],
      "model_verdict": "good",
      "samples": [
        {
          "sample_index": 0,
          "raw_response": "GOOD",
          "parsed_verdict": "good",
          "parse_status": "ok",
          "request_id": "gpt-5.4-mini-perceptual:row-1:sample-0",
          "wall_time_ms": 1137.0229170424864,
          "usage": {
            "input_tokens": 232,
            "output_tokens": 10
          }
        },
        {
          "sample_index": 1,
          "raw_response": "GOOD",
          "parsed_verdict": "good",
          "parse_status": "ok",
          "request_id": "gpt-5.4-mini-perceptual:row-1:sample-1",
          "wall_time_ms": 684.1497909626924,
          "usage": {
            "input_tokens": 232,
            "output_tokens": 10
          }
        },
        {
          "sample_index": 2,
          "raw_response": "GOOD",
          "parsed_verdict": "good",
          "parse_status": "ok",
          "request_id": "gpt-5.4-mini-perceptual:row-1:sample-2",
          "wall_time_ms": 528.8148340187036,
          "usage": {
            "input_tokens": 232,
            "output_tokens": 10
          }
        }
      ],
      "majority_vote": {
        "good": 3,
        "bad": 0,
        "abstain": 0,
        "verdict": "good",
        "tie_broken": false
      },
      "tags": [
        "irrelevant-addition",
        "nighttime"
      ]
    },
    {
      "id": "row-2",
      "premises": [
        "n",
        "nr",
        "sa"
      ],
      "conclusions": [
        "ra"
      ],
      "analyst_verdicts": [
        "good"
      ],
      "model_verdict": "bad",
      "samples": [
        {
          "sample_index": 0,
          "raw_response": "BAD",
          "parsed_verdict": "bad",
          "parse_status": "ok",
          "request_id": "gpt-5.4-mini-perceptual:row-2:sample-0",
          "wall_time_ms": 492.20404104562476,
          "usage": {
            "input_tokens": 240,
            "output_tokens": 10
          }
        },
        {
          "sample_index": 1,
          "raw_response": "BAD",
          "parsed_verdict": "bad",
          "parse_status": "ok",
          "request_id": "gpt-5.4-mini-perceptual:row-2:sample-1",
          "wall_time_ms": 506.040291977115,
          "usage": {
            "input_tokens": 240,
            "output_tokens": 4
          }
        },
        {
          "sample_index": 2,
          "raw_response": "BAD",
          "parsed_verdict": "bad",
          "parse_status": "ok",
          "request_id": "gpt-5.4-mini-perceptual:row-2:sample-2",
          "wall_time_ms": 473.6216250457801,
          "usage": {
            "input_tokens": 240,
            "output_tokens": 10
          }
        }
      ],
      "majority_vote": {
        "good": 0,
        "bad": 3,
        "abstain": 0,
        "verdict": "bad",
        "tie_broken": false
      },
      "tags": [
        "irrelevant-addition",
        "nonreflective"
      ]
    },
    {
      "id": "row-3",
      "premises": [
        "ba",
        "sa"
      ],
      "conclusions": [
        "ra"
      ],
      "analyst_verdicts": [
        "bad"
      ],
      "model_verdict": "bad",
      "samples": [
        {
          "sample_index": 0,
          "raw_response": "BAD",
          "parsed_verdict": "bad",
          "parse_status": "ok",
          "request_id": "gpt-5.4-mini-perceptual:row-3:sample-0",
          "wall_time_ms": 479.52870797598734,
          "usage": {
            "input_tokens": 234,
            "output_tokens": 10
          }
        },
        {
          "sample_index": 1,
          "raw_response": "BAD",
          "parsed_verdict": "bad",
          "parse_status": "ok",
          "request_id": "gpt-5.4-mini-perceptual:row-3:sample-1",
          "wall_time_ms": 1151.9561250461265,
          "usage": {
            "input_tokens": 234,
            "output_tokens": 10
          }
        },
        {
          "sample_index": 2,
          "raw_response": "BAD",
          "parsed_verdict": "bad",
          "parse_status": "ok",
          "request_id": "gpt-5.4-mini-perceptual:row-3:sample-2",
          "wall_time_ms": 452.44529098272324,
          "usage": {
            "input_tokens": 234,
            "output_tokens": 10
          }
        }
      ],
      "majority_vote": {
        "good": 0,
        "bad": 3,
        "abstain": 0,
        "verdict": "bad",
        "tie_broken": false
      },
      "tags": [
        "defeater",
        "painted-blue"
      ]
    }
  ]
}
