{
  "schema_version": "1.0",
  "id": "qwen3-max-intrinsic",
  "benchmark_id": "stop-sign-intrinsic",
  "benchmark_hash": "sha256:8d6097249186fabfd7bc51eb2e44859766be9ce1937d8bf19452c7b85965b87b",
  "model": {
    "provider": "openrouter",
    "model_id": "qwen/qwen3-max",
    "params": {
      "temperature": 0.0,
      "max_tokens": 2048,
      "stop": []
    }
  },
  "endorsement_config": {
    "n_samples": 3,
    "tie_break": "abstain",
    "verification_prompt_id": "defeasible-explicit-v1",
    "context_builder_premise_id": "conjunction-and-v1",
    "context_builder_conclusion_id": "disjunction-or-v1"
  },
  "framework_version": "0.1.0",
  "started_at": "2026-05-18T20:42:59.697150Z",
  "finished_at": "2026-05-18T20:43:15.839625Z",
  "items": [
    {
      "id": "row-0",
      "premises": [
        "sa"
      ],
      "conclusions": [
        "ra"
      ],
      "analyst_verdicts": [
        "good"
      ],
      "model_verdict": "good",
      "samples": [
        {
          "sample_index": 0,
          "raw_response": "GOOD",
          "parsed_verdict": "good",
          "parse_status": "ok",
          "request_id": "qwen3-max-intrinsic:row-0:sample-0",
          "wall_time_ms": 988.0572499823757,
          "usage": {
            "input_tokens": 238,
            "output_tokens": 1
          }
        },
        {
          "sample_index": 1,
          "raw_response": "GOOD",
          "parsed_verdict": "good",
          "parse_status": "ok",
          "request_id": "qwen3-max-intrinsic:row-0:sample-1",
          "wall_time_ms": 2915.784542041365,
          "usage": {
            "input_tokens": 238,
            "output_tokens": 1
          }
        },
        {
          "sample_index": 2,
          "raw_response": "GOOD",
          "parsed_verdict": "good",
          "parse_status": "ok",
          "request_id": "qwen3-max-intrinsic:row-0:sample-2",
          "wall_time_ms": 1204.541541985236,
          "usage": {
            "input_tokens": 238,
            "output_tokens": 1
          }
        }
      ],
      "majority_vote": {
        "good": 3,
        "bad": 0,
        "abstain": 0,
        "verdict": "good",
        "tie_broken": false
      },
      "tags": [
        "base-inference"
      ]
    },
    {
      "id": "row-1",
      "premises": [
        "n",
        "sa"
      ],
      "conclusions": [
        "ra"
      ],
      "analyst_verdicts": [
        "good"
      ],
      "model_verdict": "good",
      "samples": [
        {
          "sample_index": 0,
          "raw_response": "GOOD",
          "parsed_verdict": "good",
          "parse_status": "ok",
          "request_id": "qwen3-max-intrinsic:row-1:sample-0",
          "wall_time_ms": 1165.6784170190804,
          "usage": {
            "input_tokens": 242,
            "output_tokens": 1
          }
        },
        {
          "sample_index": 1,
          "raw_response": "GOOD",
          "parsed_verdict": "good",
          "parse_status": "ok",
          "request_id": "qwen3-max-intrinsic:row-1:sample-1",
          "wall_time_ms": 989.208500017412,
          "usage": {
            "input_tokens": 242,
            "output_tokens": 1
          }
        },
        {
          "sample_index": 2,
          "raw_response": "GOOD",
          "parsed_verdict": "good",
          "parse_status": "ok",
          "request_id": "qwen3-max-intrinsic:row-1:sample-2",
          "wall_time_ms": 986.1789169954136,
          "usage": {
            "input_tokens": 242,
            "output_tokens": 1
          }
        }
      ],
      "majority_vote": {
        "good": 3,
        "bad": 0,
        "abstain": 0,
        "verdict": "good",
        "tie_broken": false
      },
      "tags": [
        "irrelevant-addition",
        "nighttime"
      ]
    },
    {
      "id": "row-2",
      "premises": [
        "n",
        "nr",
        "sa"
      ],
      "conclusions": [
        "ra"
      ],
      "analyst_verdicts": [
        "good"
      ],
      "model_verdict": "good",
      "samples": [
        {
          "sample_index": 0,
          "raw_response": "GOOD",
          "parsed_verdict": "good",
          "parse_status": "ok",
          "request_id": "qwen3-max-intrinsic:row-2:sample-0",
          "wall_time_ms": 1081.0513329925016,
          "usage": {
            "input_tokens": 250,
            "output_tokens": 1
          }
        },
        {
          "sample_index": 1,
          "raw_response": "GOOD",
          "parsed_verdict": "good",
          "parse_status": "ok",
          "request_id": "qwen3-max-intrinsic:row-2:sample-1",
          "wall_time_ms": 2132.630500011146,
          "usage": {
            "input_tokens": 250,
            "output_tokens": 1
          }
        },
        {
          "sample_index": 2,
          "raw_response": "GOOD",
          "parsed_verdict": "good",
          "parse_status": "ok",
          "request_id": "qwen3-max-intrinsic:row-2:sample-2",
          "wall_time_ms": 1113.8937079813331,
          "usage": {
            "input_tokens": 250,
            "output_tokens": 1
          }
        }
      ],
      "majority_vote": {
        "good": 3,
        "bad": 0,
        "abstain": 0,
        "verdict": "good",
        "tie_broken": false
      },
      "tags": [
        "irrelevant-addition",
        "nonreflective"
      ]
    },
    {
      "id": "row-3",
      "premises": [
        "ba",
        "sa"
      ],
      "conclusions": [
        "ra"
      ],
      "analyst_verdicts": [
        "bad"
      ],
      "model_verdict": "bad",
      "samples": [
        {
          "sample_index": 0,
          "raw_response": "BAD",
          "parsed_verdict": "bad",
          "parse_status": "ok",
          "request_id": "qwen3-max-intrinsic:row-3:sample-0",
          "wall_time_ms": 1067.0987910125405,
          "usage": {
            "input_tokens": 244,
            "output_tokens": 1
          }
        },
        {
          "sample_index": 1,
          "raw_response": "BAD",
          "parsed_verdict": "bad",
          "parse_status": "ok",
          "request_id": "qwen3-max-intrinsic:row-3:sample-1",
          "wall_time_ms": 1153.2197920023464,
          "usage": {
            "input_tokens": 244,
            "output_tokens": 1
          }
        },
        {
          "sample_index": 2,
          "raw_response": "BAD",
          "parsed_verdict": "bad",
          "parse_status": "ok",
          "request_id": "qwen3-max-intrinsic:row-3:sample-2",
          "wall_time_ms": 1332.439040997997,
          "usage": {
            "input_tokens": 244,
            "output_tokens": 1
          }
        }
      ],
      "majority_vote": {
        "good": 0,
        "bad": 3,
        "abstain": 0,
        "verdict": "bad",
        "tie_broken": false
      },
      "tags": [
        "defeater",
        "painted-blue"
      ]
    }
  ]
}
