{
  "schema_version": "1.0",
  "id": "mistral-large-original",
  "benchmark_id": "stop-sign-original",
  "benchmark_hash": "sha256:5d9727b2b4f609aa067dc78ae96ed43290e31482d8b0649086f811871046f30b",
  "model": {
    "provider": "openrouter",
    "model_id": "mistralai/mistral-large-2512",
    "params": {
      "temperature": 0.0,
      "max_tokens": 2048,
      "stop": []
    }
  },
  "endorsement_config": {
    "n_samples": 3,
    "tie_break": "abstain",
    "verification_prompt_id": "defeasible-explicit-v1",
    "context_builder_premise_id": "conjunction-and-v1",
    "context_builder_conclusion_id": "disjunction-or-v1"
  },
  "framework_version": "0.1.0",
  "started_at": "2026-05-18T20:53:40.331972Z",
  "finished_at": "2026-05-18T20:53:48.075262Z",
  "items": [
    {
      "id": "row-0",
      "premises": [
        "sa"
      ],
      "conclusions": [
        "ra"
      ],
      "analyst_verdicts": [
        "good"
      ],
      "model_verdict": "good",
      "samples": [
        {
          "sample_index": 0,
          "raw_response": "GOOD",
          "parsed_verdict": "good",
          "parse_status": "ok",
          "request_id": "mistral-large-original:row-0:sample-0",
          "wall_time_ms": 1078.0992080108263,
          "usage": {
            "input_tokens": 233,
            "output_tokens": 3
          }
        },
        {
          "sample_index": 1,
          "raw_response": "GOOD",
          "parsed_verdict": "good",
          "parse_status": "ok",
          "request_id": "mistral-large-original:row-0:sample-1",
          "wall_time_ms": 593.7096669804305,
          "usage": {
            "input_tokens": 233,
            "output_tokens": 3
          }
        },
        {
          "sample_index": 2,
          "raw_response": "GOOD",
          "parsed_verdict": "good",
          "parse_status": "ok",
          "request_id": "mistral-large-original:row-0:sample-2",
          "wall_time_ms": 562.2001250158064,
          "usage": {
            "input_tokens": 233,
            "output_tokens": 3
          }
        }
      ],
      "majority_vote": {
        "good": 3,
        "bad": 0,
        "abstain": 0,
        "verdict": "good",
        "tie_broken": false
      },
      "tags": [
        "base-inference"
      ]
    },
    {
      "id": "row-1",
      "premises": [
        "n",
        "sa"
      ],
      "conclusions": [
        "ra"
      ],
      "analyst_verdicts": [
        "good"
      ],
      "model_verdict": "good",
      "samples": [
        {
          "sample_index": 0,
          "raw_response": "GOOD",
          "parsed_verdict": "good",
          "parse_status": "ok",
          "request_id": "mistral-large-original:row-1:sample-0",
          "wall_time_ms": 489.7866249666549,
          "usage": {
            "input_tokens": 238,
            "output_tokens": 3
          }
        },
        {
          "sample_index": 1,
          "raw_response": "GOOD",
          "parsed_verdict": "good",
          "parse_status": "ok",
          "request_id": "mistral-large-original:row-1:sample-1",
          "wall_time_ms": 500.24887500330806,
          "usage": {
            "input_tokens": 238,
            "output_tokens": 3
          }
        },
        {
          "sample_index": 2,
          "raw_response": "GOOD",
          "parsed_verdict": "good",
          "parse_status": "ok",
          "request_id": "mistral-large-original:row-1:sample-2",
          "wall_time_ms": 503.19183396641165,
          "usage": {
            "input_tokens": 238,
            "output_tokens": 3
          }
        }
      ],
      "majority_vote": {
        "good": 3,
        "bad": 0,
        "abstain": 0,
        "verdict": "good",
        "tie_broken": false
      },
      "tags": [
        "irrelevant-addition",
        "nighttime"
      ]
    },
    {
      "id": "row-2",
      "premises": [
        "n",
        "nr",
        "sa"
      ],
      "conclusions": [
        "ra"
      ],
      "analyst_verdicts": [
        "good"
      ],
      "model_verdict": "bad",
      "samples": [
        {
          "sample_index": 0,
          "raw_response": "BAD",
          "parsed_verdict": "bad",
          "parse_status": "ok",
          "request_id": "mistral-large-original:row-2:sample-0",
          "wall_time_ms": 617.3196249874309,
          "usage": {
            "input_tokens": 246,
            "output_tokens": 2
          }
        },
        {
          "sample_index": 1,
          "raw_response": "ABSTAIN",
          "parsed_verdict": "abstain",
          "parse_status": "ok",
          "request_id": "mistral-large-original:row-2:sample-1",
          "wall_time_ms": 607.9451669938862,
          "usage": {
            "input_tokens": 246,
            "output_tokens": 4
          }
        },
        {
          "sample_index": 2,
          "raw_response": "BAD",
          "parsed_verdict": "bad",
          "parse_status": "ok",
          "request_id": "mistral-large-original:row-2:sample-2",
          "wall_time_ms": 511.00850000511855,
          "usage": {
            "input_tokens": 246,
            "output_tokens": 2
          }
        }
      ],
      "majority_vote": {
        "good": 0,
        "bad": 2,
        "abstain": 1,
        "verdict": "bad",
        "tie_broken": false
      },
      "tags": [
        "irrelevant-addition",
        "nonreflective"
      ]
    },
    {
      "id": "row-3",
      "premises": [
        "ba",
        "sa"
      ],
      "conclusions": [
        "ra"
      ],
      "analyst_verdicts": [
        "bad"
      ],
      "model_verdict": "bad",
      "samples": [
        {
          "sample_index": 0,
          "raw_response": "BAD",
          "parsed_verdict": "bad",
          "parse_status": "ok",
          "request_id": "mistral-large-original:row-3:sample-0",
          "wall_time_ms": 530.0681250519119,
          "usage": {
            "input_tokens": 239,
            "output_tokens": 2
          }
        },
        {
          "sample_index": 1,
          "raw_response": "BAD",
          "parsed_verdict": "bad",
          "parse_status": "ok",
          "request_id": "mistral-large-original:row-3:sample-1",
          "wall_time_ms": 1191.9333749683574,
          "usage": {
            "input_tokens": 239,
            "output_tokens": 2
          }
        },
        {
          "sample_index": 2,
          "raw_response": "BAD",
          "parsed_verdict": "bad",
          "parse_status": "ok",
          "request_id": "mistral-large-original:row-3:sample-2",
          "wall_time_ms": 547.492291952949,
          "usage": {
            "input_tokens": 239,
            "output_tokens": 2
          }
        }
      ],
      "majority_vote": {
        "good": 0,
        "bad": 3,
        "abstain": 0,
        "verdict": "bad",
        "tie_broken": false
      },
      "tags": [
        "defeater",
        "painted-blue"
      ]
    }
  ]
}
