{
  "schema_version": "1.0",
  "id": "qwen3-max-perceptual",
  "benchmark_id": "stop-sign-perceptual",
  "benchmark_hash": "sha256:1ed07a656b262cabbd84e7ce28587ebfc1805b3914beb2c1cf0e57013395cb32",
  "model": {
    "provider": "openrouter",
    "model_id": "qwen/qwen3-max",
    "params": {
      "temperature": 0.0,
      "max_tokens": 2048,
      "stop": []
    }
  },
  "endorsement_config": {
    "n_samples": 3,
    "tie_break": "abstain",
    "verification_prompt_id": "defeasible-explicit-v1",
    "context_builder_premise_id": "conjunction-and-v1",
    "context_builder_conclusion_id": "disjunction-or-v1"
  },
  "framework_version": "0.1.0",
  "started_at": "2026-05-18T20:43:15.843321Z",
  "finished_at": "2026-05-18T20:43:58.425956Z",
  "items": [
    {
      "id": "row-0",
      "premises": [
        "sa"
      ],
      "conclusions": [
        "ra"
      ],
      "analyst_verdicts": [
        "good"
      ],
      "model_verdict": "good",
      "samples": [
        {
          "sample_index": 0,
          "raw_response": "GOOD",
          "parsed_verdict": "good",
          "parse_status": "ok",
          "request_id": "qwen3-max-perceptual:row-0:sample-0",
          "wall_time_ms": 1118.9155830070376,
          "usage": {
            "input_tokens": 234,
            "output_tokens": 1
          }
        },
        {
          "sample_index": 1,
          "raw_response": "GOOD",
          "parsed_verdict": "good",
          "parse_status": "ok",
          "request_id": "qwen3-max-perceptual:row-0:sample-1",
          "wall_time_ms": 1018.7853339593858,
          "usage": {
            "input_tokens": 234,
            "output_tokens": 1
          }
        },
        {
          "sample_index": 2,
          "raw_response": "GOOD",
          "parsed_verdict": "good",
          "parse_status": "ok",
          "request_id": "qwen3-max-perceptual:row-0:sample-2",
          "wall_time_ms": 1070.1096669654362,
          "usage": {
            "input_tokens": 234,
            "output_tokens": 1
          }
        }
      ],
      "majority_vote": {
        "good": 3,
        "bad": 0,
        "abstain": 0,
        "verdict": "good",
        "tie_broken": false
      },
      "tags": [
        "base-inference"
      ]
    },
    {
      "id": "row-1",
      "premises": [
        "n",
        "sa"
      ],
      "conclusions": [
        "ra"
      ],
      "analyst_verdicts": [
        "good"
      ],
      "model_verdict": "bad",
      "samples": [
        {
          "sample_index": 0,
          "raw_response": "BAD",
          "parsed_verdict": "bad",
          "parse_status": "ok",
          "request_id": "qwen3-max-perceptual:row-1:sample-0",
          "wall_time_ms": 937.5160000054166,
          "usage": {
            "input_tokens": 238,
            "output_tokens": 1
          }
        },
        {
          "sample_index": 1,
          "raw_response": "BAD",
          "parsed_verdict": "bad",
          "parse_status": "ok",
          "request_id": "qwen3-max-perceptual:row-1:sample-1",
          "wall_time_ms": 1002.4804169661365,
          "usage": {
            "input_tokens": 238,
            "output_tokens": 1
          }
        },
        {
          "sample_index": 2,
          "raw_response": "BAD",
          "parsed_verdict": "bad",
          "parse_status": "ok",
          "request_id": "qwen3-max-perceptual:row-1:sample-2",
          "wall_time_ms": 1618.4156670351513,
          "usage": {
            "input_tokens": 238,
            "output_tokens": 1
          }
        }
      ],
      "majority_vote": {
        "good": 0,
        "bad": 3,
        "abstain": 0,
        "verdict": "bad",
        "tie_broken": false
      },
      "tags": [
        "irrelevant-addition",
        "nighttime"
      ]
    },
    {
      "id": "row-2",
      "premises": [
        "n",
        "nr",
        "sa"
      ],
      "conclusions": [
        "ra"
      ],
      "analyst_verdicts": [
        "good"
      ],
      "model_verdict": "bad",
      "samples": [
        {
          "sample_index": 0,
          "raw_response": "BAD",
          "parsed_verdict": "bad",
          "parse_status": "ok",
          "request_id": "qwen3-max-perceptual:row-2:sample-0",
          "wall_time_ms": 1170.5677499994636,
          "usage": {
            "input_tokens": 246,
            "output_tokens": 1
          }
        },
        {
          "sample_index": 1,
          "raw_response": "BAD",
          "parsed_verdict": "bad",
          "parse_status": "ok",
          "request_id": "qwen3-max-perceptual:row-2:sample-1",
          "wall_time_ms": 1154.693083022721,
          "usage": {
            "input_tokens": 246,
            "output_tokens": 1
          }
        },
        {
          "sample_index": 2,
          "raw_response": "BAD",
          "parsed_verdict": "bad",
          "parse_status": "ok",
          "request_id": "qwen3-max-perceptual:row-2:sample-2",
          "wall_time_ms": 1214.9492499884218,
          "usage": {
            "input_tokens": 246,
            "output_tokens": 1
          }
        }
      ],
      "majority_vote": {
        "good": 0,
        "bad": 3,
        "abstain": 0,
        "verdict": "bad",
        "tie_broken": false
      },
      "tags": [
        "irrelevant-addition",
        "nonreflective"
      ]
    },
    {
      "id": "row-3",
      "premises": [
        "ba",
        "sa"
      ],
      "conclusions": [
        "ra"
      ],
      "analyst_verdicts": [
        "bad"
      ],
      "model_verdict": "abstain",
      "samples": [
        {
          "sample_index": 0,
          "raw_response": "",
          "parsed_verdict": "abstain",
          "parse_status": "sample_failed",
          "request_id": "qwen3-max-perceptual:row-3:sample-0"
        },
        {
          "sample_index": 1,
          "raw_response": "",
          "parsed_verdict": "abstain",
          "parse_status": "sample_failed",
          "request_id": "qwen3-max-perceptual:row-3:sample-1"
        },
        {
          "sample_index": 2,
          "raw_response": "",
          "parsed_verdict": "abstain",
          "parse_status": "sample_failed",
          "request_id": "qwen3-max-perceptual:row-3:sample-2"
        }
      ],
      "majority_vote": {
        "good": 0,
        "bad": 0,
        "abstain": 3,
        "verdict": "abstain",
        "tie_broken": false
      },
      "tags": [
        "defeater",
        "painted-blue"
      ]
    }
  ]
}
